{
  "contract_version": "historical-import-workflow/v1",
  "schema_version": "historical-import-workflow-confirmation-request/v1",
  "preview_id": "hip_11111111111111111111111111111111",
  "preview_digest": "sha256:1111111111111111111111111111111111111111111111111111111111111111",
  "snapshot_version": "hsv_1",
  "decision": "confirm"
}
